{
  "$schema": "https://json-schema.org/draft/2020-12/schema",
  "title": "decks/<name>.json of a .cardpack",
  "type": "object",
  "required": ["name", "champion", "cards"],
  "additionalProperties": false,
  "properties": {
    "name": {"type": "string", "minLength": 1, "maxLength": 60},
    "champion": {"type": "string", "pattern": "^[A-Za-z0-9_]{1,64}$"},
    "code": {"type": "string", "maxLength": 400, "pattern": "^[A-Za-z0-9+/]+={0,2}$"},
    "arena": {"type": "boolean"},
    "cards": {"type": "array", "maxItems": 200, "items": {"type": "string", "pattern": "^[A-Za-z0-9_]{1,64}$"}}
  }
}
