{
  "name": "Freeze Mage",
  "champion": "HERO_08",
  "code": "AAEDAf0ECOWVBOeVBK+hBLWhBMahBJGiBNeiBNmiBAvhlQTilQTklQTmlQTUlgTzoAT0oASVogSXogSYowTFowQAAA==",
  "cards": ["VAN_CS2_023", "VAN_CS2_023", "VAN_CS2_024", "VAN_CS2_024", "VAN_CS2_026", "VAN_CS2_026", "VAN_CS2_027", "VAN_CS2_028", "VAN_CS2_028", "VAN_CS2_029", "VAN_CS2_029", "VAN_CS2_031", "VAN_CS2_031", "VAN_CS2_032", "VAN_EX1_005", "VAN_EX1_012", "VAN_EX1_015", "VAN_EX1_015", "VAN_EX1_050", "VAN_EX1_279", "VAN_EX1_289", "VAN_EX1_289", "VAN_EX1_295", "VAN_EX1_295", "VAN_EX1_559", "VAN_EX1_561", "VAN_EX1_594", "VAN_EX1_594", "VAN_NEW1_021", "VAN_NEW1_021"]
}
