{
  "name": "Control Warrior",
  "champion": "HERO_01",
  "code": "AAEDAQcIraEEr6EE3KEExKIExqIE1qIE2aIExKoEC5eWBJiWBP+WBLCXBLGhBMShBNChBLmiBL6iBMCiBMOiBAAA",
  "cards": ["VAN_CS2_106", "VAN_CS2_106", "VAN_CS2_108", "VAN_CS2_108", "VAN_EX1_002", "VAN_EX1_005", "VAN_EX1_007", "VAN_EX1_007", "VAN_EX1_048", "VAN_EX1_048", "VAN_EX1_085", "VAN_EX1_085", "VAN_EX1_116", "VAN_EX1_391", "VAN_EX1_391", "VAN_EX1_402", "VAN_EX1_402", "VAN_EX1_407", "VAN_EX1_407", "VAN_EX1_410", "VAN_EX1_410", "VAN_EX1_411", "VAN_EX1_414", "VAN_EX1_558", "VAN_EX1_561", "VAN_EX1_572", "VAN_EX1_606", "VAN_EX1_606", "VAN_NEW1_011", "VAN_NEW1_011"]
}
