{
  "name": "Midrange Shaman",
  "champion": "HERO_02",
  "code": "AAEDAaa0BgK1oQSHogQO7ZUE7pUEr5YE55YE+ZYEsqEEy6EE06EEhKIEiaIEjqIEk6IE1KIEkKMEAAA=",
  "cards": ["VAN_CS2_042", "VAN_CS2_042", "VAN_CS2_045", "VAN_CS2_045", "VAN_CS2_179", "VAN_CS2_179", "VAN_EX1_008", "VAN_EX1_008", "VAN_EX1_012", "VAN_EX1_067", "VAN_EX1_067", "VAN_EX1_093", "VAN_EX1_093", "VAN_EX1_238", "VAN_EX1_238", "VAN_EX1_245", "VAN_EX1_246", "VAN_EX1_246", "VAN_EX1_248", "VAN_EX1_248", "VAN_EX1_259", "VAN_EX1_259", "VAN_EX1_284", "VAN_EX1_284", "VAN_EX1_556", "VAN_EX1_556", "VAN_EX1_565", "VAN_EX1_565", "VAN_EX1_575", "VAN_EX1_575"]
}
