{
  "name": "Control Priest",
  "champion": "HERO_09",
  "code": "AAEDAa0GBr6WBICXBLehBNKhBJiiBKeiBAzLlQTNlQTQlQS3lwT6oASAoQSTogSpogSXowSrowStowTEowQAAA==",
  "cards": ["VAN_CS1_112", "VAN_CS1_112", "VAN_CS1_130", "VAN_CS1_130", "VAN_CS2_004", "VAN_CS2_004", "VAN_CS2_117", "VAN_CS2_117", "VAN_CS2_181", "VAN_CS2_181", "VAN_CS2_234", "VAN_CS2_235", "VAN_CS2_235", "VAN_EX1_016", "VAN_EX1_091", "VAN_EX1_284", "VAN_EX1_284", "VAN_EX1_298", "VAN_EX1_334", "VAN_EX1_339", "VAN_EX1_339", "VAN_EX1_591", "VAN_EX1_591", "VAN_EX1_621", "VAN_EX1_621", "VAN_EX1_622", "VAN_EX1_624", "VAN_EX1_624", "VAN_NEW1_020", "VAN_NEW1_020"]
}
