{
  "name": "Midrange Hunter",
  "champion": "HERO_05",
  "code": "AAEDAR8EhZYEnZYEwJYE3KEEDcqWBNGWBPiWBLGXBLyhBL2hBMyiBM2iBM+iBKKjBKOjBKijBMOjBAAA",
  "cards": ["VAN_CS2_084", "VAN_CS2_120", "VAN_CS2_237", "VAN_DS1_070", "VAN_DS1_070", "VAN_DS1_184", "VAN_DS1_184", "VAN_EX1_028", "VAN_EX1_028", "VAN_EX1_029", "VAN_EX1_029", "VAN_EX1_116", "VAN_EX1_534", "VAN_EX1_534", "VAN_EX1_536", "VAN_EX1_536", "VAN_EX1_538", "VAN_EX1_538", "VAN_EX1_539", "VAN_EX1_539", "VAN_EX1_610", "VAN_EX1_610", "VAN_EX1_611", "VAN_EX1_611", "VAN_EX1_617", "VAN_EX1_617", "VAN_NEW1_019", "VAN_NEW1_019", "VAN_NEW1_031", "VAN_NEW1_031"]
}
