{
  "name": "Zoolock",
  "champion": "HERO_07",
  "code": "AAEDAf0GBK6hBMOhBNyhBMWjBA33lQT7lQTVlgTtlgSBoQSyoQS9oQTToQTuoQSdogSjogTUogTDowQAAA==",
  "cards": ["VAN_CS2_062", "VAN_CS2_062", "VAN_CS2_065", "VAN_CS2_065", "VAN_CS2_188", "VAN_CS2_188", "VAN_EX1_004", "VAN_EX1_008", "VAN_EX1_008", "VAN_EX1_019", "VAN_EX1_019", "VAN_EX1_029", "VAN_EX1_029", "VAN_EX1_046", "VAN_EX1_093", "VAN_EX1_093", "VAN_EX1_116", "VAN_EX1_162", "VAN_EX1_162", "VAN_EX1_308", "VAN_EX1_308", "VAN_EX1_310", "VAN_EX1_310", "VAN_EX1_319", "VAN_EX1_319", "VAN_EX1_556", "VAN_EX1_556", "VAN_NEW1_019", "VAN_NEW1_019", "VAN_NEW1_021"]
}
