{
  "name": "Midrange Paladin",
  "champion": "HERO_04",
  "code": "AAEDAZ8FAraiBLeiBA6MlgSOlgSQlgSBoQSuoQS6oQS9oQS+oQTLoQTgoQSwogS1ogTDowTFowQAAA==",
  "cards": ["VAN_CS2_092", "VAN_CS2_092", "VAN_CS2_093", "VAN_CS2_093", "VAN_CS2_097", "VAN_CS2_097", "VAN_CS2_188", "VAN_CS2_188", "VAN_EX1_004", "VAN_EX1_004", "VAN_EX1_021", "VAN_EX1_021", "VAN_EX1_029", "VAN_EX1_029", "VAN_EX1_032", "VAN_EX1_032", "VAN_EX1_067", "VAN_EX1_067", "VAN_EX1_130", "VAN_EX1_130", "VAN_EX1_362", "VAN_EX1_362", "VAN_EX1_382", "VAN_EX1_382", "VAN_EX1_383", "VAN_EX1_384", "VAN_NEW1_019", "VAN_NEW1_019", "VAN_NEW1_021", "VAN_NEW1_021"]
}
