{
  "name": "Miracle Rogue",
  "champion": "HERO_03",
  "code": "AAEDAaIHBvigBPugBIahBLWhBNyhBKWjBAz8lQT9lQTclgTqlgT7lgTBoQTUoQTdoQTfoQTkoQTnoQTooQQAAA==",
  "cards": ["VAN_CS2_072", "VAN_CS2_072", "VAN_CS2_073", "VAN_CS2_074", "VAN_CS2_074", "VAN_CS2_146", "VAN_CS2_233", "VAN_EX1_012", "VAN_EX1_044", "VAN_EX1_044", "VAN_EX1_095", "VAN_EX1_095", "VAN_EX1_116", "VAN_EX1_124", "VAN_EX1_124", "VAN_EX1_128", "VAN_EX1_128", "VAN_EX1_129", "VAN_EX1_129", "VAN_EX1_134", "VAN_EX1_134", "VAN_EX1_144", "VAN_EX1_144", "VAN_EX1_145", "VAN_EX1_145", "VAN_EX1_278", "VAN_EX1_278", "VAN_EX1_581", "VAN_EX1_581", "VAN_EX1_613"]
}
