{
  "name": "Handlock",
  "champion": "HERO_07",
  "code": "AAEDAf0GCvuVBK6XBIKhBK+hBNahBNyhBJqiBJyiBKWiBNyiBAr3lQTrlgTtlgT6oATAoQTCoQTJoQTToQTaoQSqowQAAA==",
  "cards": ["VAN_CS2_062", "VAN_CS2_062", "VAN_CS2_065", "VAN_CS2_117", "VAN_CS2_117", "VAN_CS2_203", "VAN_EX1_005", "VAN_EX1_043", "VAN_EX1_043", "VAN_EX1_045", "VAN_EX1_045", "VAN_EX1_058", "VAN_EX1_058", "VAN_EX1_093", "VAN_EX1_093", "VAN_EX1_097", "VAN_EX1_105", "VAN_EX1_105", "VAN_EX1_116", "VAN_EX1_302", "VAN_EX1_302", "VAN_EX1_303", "VAN_EX1_308", "VAN_EX1_308", "VAN_EX1_309", "VAN_EX1_323", "VAN_EX1_564", "VAN_EX1_620", "VAN_EX1_620", "VAN_NEW1_003"]
}
