{
  "name": "Midrange Druid",
  "champion": "HERO_06",
  "code": "AAEDAZICCK2hBK+hBLWhBL6hBNuhBI+jBJajBNGjBAvZlQTblQSwlgSzlgTdlgTpoQTxoQTUogS8owS9owTFqgQAAA==",
  "cards": ["VAN_CS2_011", "VAN_CS2_011", "VAN_CS2_012", "VAN_CS2_012", "VAN_CS2_182", "VAN_CS2_182", "VAN_CS2_189", "VAN_CS2_189", "VAN_EX1_002", "VAN_EX1_005", "VAN_EX1_012", "VAN_EX1_032", "VAN_EX1_110", "VAN_EX1_154", "VAN_EX1_154", "VAN_EX1_166", "VAN_EX1_166", "VAN_EX1_169", "VAN_EX1_169", "VAN_EX1_556", "VAN_EX1_556", "VAN_EX1_571", "VAN_EX1_571", "VAN_EX1_573", "VAN_EX1_590", "VAN_NEW1_007", "VAN_NEW1_007", "VAN_NEW1_008", "VAN_NEW1_008", "VAN_NEW1_040"]
}
